发布时间,问题,回答
1301290637,如何备份/下载知乎中的回答？, 看了这个问题下面各位的回答，我想，也许知乎未来可以考虑添加一个「<b>Note it</b>」的功能。在每个问题或者回答下面，用户点击了「Note it」按钮，该问题/回答则会自动汇总在一个单独的页面里。<br><br>不过我还没想好的是，这个「Note it」功能如何和「收藏」功能区分？或许两者就是应该合并的。 
1301330269,现时代，国内中文杂志上身体露点的审查标准到底是什么？," 没有准确描述的标准。只能通过自己把控、琢磨和撞墙试错，来找到这个边界。<br><br>基本上，别太过就行。<br><br>什么算太过呢？比如——<br>别直接露，若隐若现也比直接露要更安全。<br>如果特别想直接露，那就别表明是露点，处理成艺术作品要更安全。<br>如果处理成了艺术作品，也别露太多，一期杂志露一两页就好，别整本都是。<br>如果露了一两页，也最好别露下体，乳房即可。<br>如果露了下体，最好别露毛。<br><br>总体而言，我国的这个制度虽然没有特别明确的成文文字，但基本上和美国电影分级制度媲美。关于后者，推荐观看 2006 年的一部纪录片《This Film Is Not Yet Rated》（<a href=""https://link.zhihu.com/?target=http%3A//is.gd/jTpw5F"" class="" external"" target=""_blank"" rel=""nofollow noreferrer""><span class=""invisible"">http://</span><span class=""visible"">is.gd/jTpw5F</span><span class=""invisible""></span></a>）。 "
1301333339,对于初入职场的应届生，互联网产品经理和财经记者要如何选择？, 的确有许多媒体人向互联网领域转型，但要区分这里面有三种人：<br><b>第一种人，是机会主义者</b>，在岸上看多了互联网怎么做，觉得自己看见了新的机会，忍不住想跳进去也弄一把。<br><b>第二种人，是对媒体失去信心</b>，媒体在中国是一个不可能有太多钱挣的职业，市场化媒体成长历史太短，还没来得及风华正茂，就遭受了互联网的冲击。<br><b>第三种人，是坚定的互联网信仰者</b>，因为大量的关注和观察，对其机制有着深入的了解和思考，因而发自内心地相信互联网，并且相比起在旁边看，更有动力动手去做，去实现。<br><br>明确一下自己是哪种人，如果是第一种人，那么去媒体和去互联网都不合适。如果是第二种人，那还是可以去媒体尝试一下。如果是第三种人，就不用犹豫了。<br><br>如果有记者梦，还是可以尝试一下做记者。这是一个非常好的开拓思路、学习自我教育、提高对人和事的判断的道路。 
1301500365,负二是谁？, 说起话来比我还眉飞色舞的人。<br>数码玩具比我还多的人。<br>进行文字创作时比我还冷静的人。 
1301500753,知乎在投资领域有哪些专家级人物？," 补充几个——<br><br><b>周逵</b>：红杉资本合伙人<br><a href=""http://www.zhihu.com/people/zhou-kui"" class=""internal""><span class=""invisible"">http://www.</span><span class=""visible"">zhihu.com/people/zhou-k</span><span class=""invisible"">ui</span><span class=""ellipsis""></span></a> "
1301500851,国内有哪些知名的创投公司？其中有哪些人已在知乎上？," 可参看——<b>知乎在投资领域有哪些专家用户？</b><br><a href=""http://www.zhihu.com/question/19561826"" class=""internal""><span class=""invisible"">http://www.</span><span class=""visible"">zhihu.com/question/1956</span><span class=""invisible"">1826</span><span class=""ellipsis""></span></a> "
1301501703,知乎和邮件组有什么区别？, 邮件组有边界（即明确的参与者），并且只有明确了边界，才有可能有讨论。<br><br>任何一个邮件组若不设定边界，也就是允许任何人加入，那么这个邮件组的讨论效率就会极大降低，到最后就只剩通告送达的功能了。<br><br>邮件组内部成员之间没有其他交互渠道，如果要交互，只能采用邮件组之外的手段。<br><br>而相比之下，知乎没有边界，不设定人群，但通过话题、社交关系等等方式为用户找到适合自己的地方，此外，知乎有很多功能来实现用户之间的交互，比如赞同、感谢、评论、私信。 
1301502752,在遇到极大的困难的时候，如何一直保持高昂的斗志？, 情绪容易起伏，客观地说，还是情感不够成熟所致。但这并不一定是坏事，年轻人容易情绪起伏，但在战斗的时候也可能因此更有冲劲，更能啃下硬骨头。<br><br>抛开情绪是否极大起伏不说，在遇到极大困难的时候，对任何人，无论年纪，都是一个挑战。<br><br>应对这个挑战，最重要的就是问自己：是否相信这件事？或者，是否相信它所通往的未来？<br><br>这不是鼓吹人定胜天，不是有信念就能战胜一切。是否相信，回答的是如下问题——是否坚定？是否能不顾一切地找到解决的办法？是否能在最后五分钟还落后10分的时候还会拼到底？<br><br>一个强大的人，更重要的任务是学会解决问题的能力，以及因此而来的解决问题的信心，而不仅仅是一堆解决问题的办法。<br><br>要论乐观主义斗志，最好的榜样还得数孙悟空。唐僧经常不信任他，队友总是不给力，前往西天一路上的大劫难，哪个是悟空自己搞定的？有任何两个大妖怪是用相同的办法搞定的？但从来没有任何困难会让这倒霉猴子打过退堂鼓。<br><br>清明政治如是，情感如是，创业亦如是。 
1301591127,哪一个公司的愚人节恶作剧最让你捧腹?, 捧腹说不上，但 @裘伯纯 Benjamin 律师刚才给创新工场全体工友发送的一封邮件差点让我激动地跳起来——<br><blockquote>苹果公司的CEO，Steve Jobs，今天11点来工场参观。请不要围观。桌上若有Android手机，请暂时收起来。谢谢配合。</blockquote>到现在我的兴奋劲儿都没过去，小心脏还在突突地蹦。 
1301597217,知乎怎么处理敏感的问题或回答？, 知乎是一个试图让人们发掘和交换藏在彼此头脑中的宝贵知识和经验的地方，请理解，它暂时不能变成一个牛博。<br><br>我赞同，「部分的知识等于没有知识」。但，如果我们心存念想，互相提高彼此的智识，只会让这个国家更好，而不是更糟。让每个人变得更聪明、更有自己的判断，这也正是构建一个理想社会的基础。<br><br>知乎这群创业者也都是理想主义者。请相信，知乎团队不是一群不管黑白、一心研究刽子手技法的人。他们有时候不得不咬牙去掉某些内容，但永远不是为了求得政治利益。<br><br>还是那句话，任何促进信息的自由流动的东西，骨子里都是好东西。不管这个促进力量是大还是小。 
1301633045,Formspring 作为社交化的生活问答网站，是不是有点低调了？, 一句话回答：<b>Formspring 即使将答案开放给了搜索引擎，完全没什么意义。</b><br><br>解释原因——<br><br>同是社会化问答网站，但知乎/Quora这样的网站，和 Formspring 有着很大的不同。<br><br>知乎/Quora 通过社会化，强化了回答者的个人信用，每个人的回答通过一个公共评价体系，建立了信用，也因此建立了自己的社会化身份，并且因为彼此的信用和了解，可以建立起新的社会化关系。在这方面，颇类似于微博/Twitter。<br><br>而 Formspring 的问答，过于强调了问答者现有的社会化关系，这种基于现有社会化关系的问答，有其价值，并且我相信知乎通过一些细节上的改进，是可以很容易拓展到这部分市场的，但是，现在的 Formspring 太过于强调既有的社会化关系之间的问答，这带来的结果是，很多回答是「人之毒药，我之蜜肴」。<br><br>举个例子：我问「北京哪些日本料理餐馆最好？」在知乎上问，可以得到很好的答案，不同的回答还可以为读者梳理出优化选择。而如果在 Formspring 上问，我只能问张亮，或者周源，他们俩的回答，很可能不靠谱，我要是把这个问题给苗炜，他会有时间理我吗？<br><br>再举个例子，我如果问「国内哪些 iOS 开发团队收入最高？」我如果在 Formspring 上问，我只能祈祷我身边的朋友里面有懂行的。如果他们不懂，那问题就废了，如果他们回答了，我也没有一个公共评价体系去判断他们是不是真的懂。 
1301644391,创新工场项目的股权是如何分配的？, 创业者自己定。和我们谈融资，以及愿意出让多少股份，谈呗。一般来说，创新工场在种子期投资所占股份比例是很公平的。<br><br>当然，对于少数几个早期工场自己作为创始人来创立的项目，股权分配是工场和创始团队一起商量出来的。 
1301673775,意大利自助游应该如何安排行程？, 我去年十一期间去了意大利，但只在罗马这一个城市停留，所以也只能说一些关于在罗马旅行的小贴士。<br><br>-------- 不嫌啰嗦的罗马旅行小贴士分割线 --------<br><br><b>地铁：</b>罗马号称有地铁，但一共就两条线，呈「X」形状，只覆盖市中心。<br><br><b>火车：</b>两条地铁线的四头，各自连接有通往郊区的火车，如果找酒店，千万不要找那种号称「靠近轨道交通」的地方，我上次去就上当了，以为和巴黎一样是地铁，结果发现是火车，坐 20 分钟火车才能到我住的地方，并且火车晚上 10 点就收班了，很不便于晚上在市区里活动。<br><br><b>市中心区：</b>罗马市中心区很小，著名的人文景观中大部分都在台伯河东岸，只有梵蒂冈在台伯河西岸。如果住在市中心区，其实就没什么交通费了，罗马市区很小，基本上所有著名的人文景观，地铁加步行即可达。怎么算是市中心区呢？一个简单的判断方法是：地铁线覆盖的地方。再次强调，是地铁，不是其他轨道交通。<br><br><b>酒店：</b>市中心区的酒店很不便宜，但如果你不嫌弃房间小的话，在市中心区还是能找到一些价格还算适中的酒店。小有多小呢？整个房间就刚好放下一张床，外加一个玲珑的洗手间。<br><br><b>景点：</b>多走路吧，我在罗马基本上就是步行，提前设计几条线路，每天走一条，就够你拍几百张照片了。如果你（或者你的女友）是一个摄影控，建议你每天的线路不要有两个以上的主要景观，否则走不完。<br>　　另外，热门景点，请留出足够的时间去排队，排队最长的要数梵蒂冈圣彼得大教堂、梵蒂冈博物馆（有米开朗基罗画的上帝创造亚当天顶画的地方），以及斗兽场。这三处，每个地方排队一个小时很正常。<br><br><b>吃：</b>去意大利吃比萨，这没什么新鲜的。我对吃饭向来不太讲究。不过，罗马街头的冰淇淋店很多，而且味道都超！级！好！<br><br><b>夜晚：</b>我不习惯逛夜场，所以晚上也是步行乱串，各种小街小道，在夜色和路灯下也很漂亮，摄影控同学，晚上你也不会闲下来的。尤其是那些喷泉。建议喷泉都可以留到晚上去看，一来是短短几天可以趁白天多去一些其他地方，二来是所有的喷泉都设计了非常迷人的灯光照射。当然，如果时间充裕，可以白天再去看一次，不同的感觉。<br><br><b>互联网：</b>请记住，中国是街头互联网最发达的国家之一。手机漫游上网很贵，请当心。如果可以，就别带笔记本电脑了，倒倒照片还行，想上网工作就算了。很少见到咖啡馆有 Wi-Fi 的。大部分酒店有 Wi-Fi，但都在大堂，而且有的还不免费，房间里的 Wi-Fi 就更别指望了。<br><br><b>现金：</b>不用带太多。我基本就没提前换任何现金，确保你的 Visa 卡是双币的、并且开通了提现功能和提现密码，到那里后，随便找一个取款机就 OK。<br><br>先说到这里吧，想起什么再补充。 
1301761050,哪些情况下，中英夹杂的表达不会让人讨厌？,<b>效率优先</b>──这是我对说话中英文夹杂是否合适的判断标准。<br><br>所谓效率优先，就是一个词，或者一句话，使用什么来表达，能够最快速、最高效地让听者明白、理解，不产生歧义，无需大脑进行额外的运算。<br><br><b>任何影响沟通效率的表达，都是装 13。</b>这既包括中文夹杂大量英文，也包括为了追求中文纯净度，刻意地将英文都转换成中文，不管是否听者容易明白。<br><br>什么时候英文表达比中文效率高呢？<br><ol><li>听者的中文词汇量低于英文。<br></li><li>中译名不统一，比如说 Android，比说安致、安卓更容易让听者明白。但如果听者一辈子说的都是安卓，那对他来说，这个词就是统一的，无歧义的，那就对他说安卓。<br></li><li>很难用一个简短的中文词来准确表述的英文词，比如 campaign、offer、flow（ Hip Hop 里的一个术语）。<br></li><li>没有中译名、并且很难取中译名的英文词，这个常见于品牌名或产品名，比如 iPhone、Kindle、Basic 语言、Quora、Facebook、PhotoShop、Gala（一支很出色的国内摇滚乐队）。</li><li>中译名太长，非要用中文名表达反而降低了对整句话的表达和接收效率，比如不说 NBA，非说美国职业篮球联合会（或美职篮），不说 IBM，非说国际商用机器公司。</li><li>大家都习以为常的说法，比如一帮互联网从业者在一起，不说 Web，非说万维网。</li><li>欢迎补充。</li></ol>
1301762791,Adidas 为什么要将品牌 slogan 改成 Adidas is all in ?, 因为使用「爱拼才会赢」太俗气了，所以便采用了这句话的英文翻译：All in。 
1301804868,如果一个人一开始追你很热烈，但当你开始有回应了就表现冷淡，开始撤退，说自己很忙可能未来两年内都没什么时间谈恋爱，这说明什么？, 说明他/她发现自己不够喜欢你。 
1301807984,创新工场孵化项目，A轮之前创新工场要占到40%的股权，是否是这样的呢？另外，创业者该如何选择天使呢？, 问题的补充说明中有几个问题。我分别答一下。<br><br>第一，创新工场的种子投资不会占你那么高股份。这个天使投资人所说非实，他要不就是故意说假话，要不就是不负责任地胡说。<br><br>第二，天使的选择，投资决策速度快，的确是一个重要的考虑，因为对于一个互联网创业团队来说，本来就是要和时间赛跑。<br><br>第三，除了速度快之外，同样重要——有时甚至更重要——的考虑因素是，这个天使是否：<br><ol><li>对你要做的事情和发展方向有深刻的理解和强烈的信念；<br></li><li>对你所处的领域有广泛且深入的投入；<br></li><li>对互联网产品有细致的体验和观察；</li><li>对如何进行互联网创业有丰富的经验；<br></li><li>手头有大量资源可以帮助你快速成长；<br></li><li>品格正直，不说假话，不说胡话，不会不懂装懂。：）<br></li></ol><br>欢迎在知乎上私信@张亮、@高晓虎、@张丽君、@曹飞，以作进一步沟通。 
1301819283,微博140字数限制是如何由来的？,<b>短信。</b>源头是 Twitter。Twitter 最初是让用户发短信来更新自己的状态用的。一条短信的长度上限是 140 个英文字符（包括字母、空格、标点符号）。<br><br>Twitter 支持 Unicode 编码，在 Unicode 里面，一个中文字符和一个英文字符相等，使得一条推的 140 个字符数限制也沿用到了中文上。但，中文一个字符就可以容纳一个字，而中文一个字的信息含量远远超过英文一个字母， 因此 140 字的中文可表达的内容也大大超过了英文。<br><br>后来饭否、嘀咕等国内的 Twitter 类服务也沿用了这种习惯，便自然而然成为了事实标准。如果现在再强制缩短，恐引起用户的不满，并且也会极大影响中文微博客使用的形态和行为。 
1301909051,知乎上被关注最多的10个人是谁？,"<b>更新</b>：<u>截至 2011 年 4 月 30 日 14:40</u>，手工统计结果如下——<br><br><ol><li><b>李开复</b>，关注者：8219。<a href=""http://www.zhihu.com/people/kaifulee"" class=""internal""><span class=""invisible"">http://www.</span><span class=""visible"">zhihu.com/people/kaiful</span><span class=""invisible"">ee</span><span class=""ellipsis""></span></a></li><li><b>keso</b>，关注者：6527。<a href=""http://www.zhihu.com/people/keso"" class=""internal""><span class=""invisible"">http://www.</span><span class=""visible"">zhihu.com/people/keso</span><span class=""invisible""></span></a></li><li><b>杨勃 (阿北)</b>，关注者：5444。<a href=""http://www.zhihu.com/people/yangbo"" class=""internal""><span class=""invisible"">http://www.</span><span class=""visible"">zhihu.com/people/yangbo</span><span class=""invisible""></span></a></li><li><b>白鸦</b>，关注者：5301。<a href=""http://www.zhihu.com/people/baiya"" class=""internal""><span class=""invisible"">http://www.</span><span class=""visible"">zhihu.com/people/baiya</span><span class=""invisible""></span></a></li><li><b>Fenng</b>，关注者：4375。<a href=""http://www.zhihu.com/people/fenng"" class=""internal""><span class=""invisible"">http://www.</span><span class=""visible"">zhihu.com/people/fenng</span><span class=""invisible""></span></a></li><li><b>胡维</b>，关注者：4077。<a href=""http://www.zhihu.com/people/whale"" class=""internal""><span class=""invisible"">http://www.</span><span class=""visible"">zhihu.com/people/whale</span><span class=""invisible""></span></a></li><li><b>张亮</b>，关注者：3691。<a href=""http://www.zhihu.com/people/imike"" class=""internal""><span class=""invisible"">http://www.</span><span class=""visible"">zhihu.com/people/imike</span><span class=""invisible""></span></a></li><li><b>黄继新</b>，关注者：3554。<a href=""http://www.zhihu.com/people/jixin"" class=""internal""><span class=""invisible"">http://www.</span><span class=""visible"">zhihu.com/people/jixin</span><span class=""invisible""></span></a></li><li><b>边江</b>，关注者：3112。<a href=""http://www.zhihu.com/people/bian"" class=""internal""><span class=""invisible"">http://www.</span><span class=""visible"">zhihu.com/people/bian</span><span class=""invisible""></span></a></li><li><b>李黎</b>，关注者：3205。<a href=""http://www.zhihu.com/people/lili"" class=""internal""><span class=""invisible"">http://www.</span><span class=""visible"">zhihu.com/people/lili</span><span class=""invisible""></span></a></li><li><b>周源</b>，关注者：2825。<a href=""http://www.zhihu.com/people/zhou-yuan"" class=""internal""><span class=""invisible"">http://www.</span><span class=""visible"">zhihu.com/people/zhou-y</span><span class=""invisible"">uan</span><span class=""ellipsis""></span></a></li><li><b>flypig</b>，关注者：2701。<a href=""http://www.zhihu.com/people/flypig"" class=""internal""><span class=""invisible"">http://www.</span><span class=""visible"">zhihu.com/people/flypig</span><span class=""invisible""></span></a></li><li><b>赵阿萌</b>，关注者：2436。<a href=""http://www.zhihu.com/people/amonjok"" class=""internal""><span class=""invisible"">http://www.</span><span class=""visible"">zhihu.com/people/amonjo</span><span class=""invisible"">k</span><span class=""ellipsis""></span></a></li><li><b>成远</b>，关注者：2295。<a href=""http://www.zhihu.com/people/chengyuan"" class=""internal""><span class=""invisible"">http://www.</span><span class=""visible"">zhihu.com/people/chengy</span><span class=""invisible"">uan</span><span class=""ellipsis""></span></a></li></ol>"
1301910743,我们为什么会关注他人？, 开复和知乎上的其他用户一样，都会更倾向于关注回答质量高的用户。所以，加油吧！ 
1301917180,如果投资者善意提醒说，如果不接受投资，就投给对手，怎么办？,<ol><li>这个投资人说的是实话。<br></li><li>有的实话听起来很伤人。比如：你如果不爱我，我就去爱别人了。<br></li><li>一个人说这种很伤人的实话，说明其不是智商低就是情商低，或二者皆低。<br></li><li>如果一个人对你说这种很伤人的实话，说明他不够爱你。<br></li><li>投资，尤其是早期投资，看的就是人。一个优秀的创业者，是早期投资人最重要（有时候甚至是唯一）的判断标准。如果这个投资人不够爱你，你最好也别爱他。<br></li><li>如果这个投资人的智商或情商有问题，你也最好别拿他的钱。<br></li><li>根据问题的补充说明来看，如果你和这个投资人之间有各种障碍使得你们难以合作，那么，就要看你们有多爱对方了。<br></li></ol>
1302023729,朋友老说 iPhone 非常难用，触摸屏没有实体键盘那样的手感，说 iPad 就是 iPod touch 的放大版。请问我该如何应对他？,"<ol><li>朋友老说 iPhone 非常难用，触摸屏没有实体键盘那样的手感。<br><b>回复：上网很爽。</b></li><li>iPad 就是 iPod touch 的放大版。<br><b>回复：上网很爽。</b></li><li>iTunes 也非常难用，像艾利和那样直接通过我的电脑直接拷歌进去多好。<br><b>回复：使用同步助手（<a href=""https://link.zhihu.com/?target=http%3A//tongbu.com"" class="" external"" target=""_blank"" rel=""nofollow noreferrer""><span class=""invisible"">http://</span><span class=""visible"">tongbu.com</span><span class=""invisible""></span></a>），比 iTunes 好用。</b></li></ol>"
1302052844,知乎开始强制实名了吗？, 我不是知乎成员啦，强制实名的事我还真不知道。<br><br>不过，我认为，实名是让知乎社区里的成员说实话、听实话的保障。当然，常用网名也有如此效果。 
1302105684,知乎的第一批用户是一群什么样的人？, 互联网从业者、创业者、投资人、媒体人士、创意工作者，以及其他人士（可见评论）。 
1302109526,LBS中，Location重要还是Service更重要？, 当然 Service <b>更</b>重要。<br><br>一切优秀的产品都应从用户的真实需求出发，抛弃对是否要 Location-based、是否要社会化、是否要移动、是否要有游戏性的非理性执着。<br><br>一旦执著于 Location-based，社会化、移动、游戏性，就像手里有了一把锤子，于是看见什么都会当作钉子。<br><br>换言之，那些都是好东西，是好的底层基础（infrastructure），或者好的 enabler，但不是全部建筑。先考虑需求，再考虑如何解决，再考虑使用什么技术和工具。<br><br>不过，最好创业者本人（或者共同创始人中有人）对所需的技术和工具很熟谙，否则容易有天花板。 
1302112910,知乎除了口碑传播以外，还有其他的宣传推广渠道吗？," 由于目前知乎还处于不断学习如何建设一个良好社区、天天改进产品、夜夜修理 bug 阶段，因此不敢大规模放开注册，所以还没有做任何宣传推广。<br><br>邀请码搞得很紧张，也是这个原因。有人问过这是否饥饿营销，我的回答可见：<br><a href=""http://www.zhihu.com/question/19562225"" class=""internal""><span class=""invisible"">http://www.</span><span class=""visible"">zhihu.com/question/1956</span><span class=""invisible"">2225</span><span class=""ellipsis""></span></a> "
1302113663,怎样鼓励用户写答案总结？, 不用鼓励，用户看多了答案总结，自然也就知道怎么写了。<br><br>此外，现在知乎上绝大部分问题都是很难用简单的语言进行总结的，因此，少数一些值得总结的，知乎的同学做一下，就可以起到示范效应了。 
1302244214,知乎如何应对互联网管制?," 请参看——<br><b>知乎怎么处理敏感的问题或回答？</b><a href=""http://www.zhihu.com/question/19586194#37075"" class=""internal""><span class=""invisible"">http://www.</span><span class=""visible"">zhihu.com/question/1958</span><span class=""invisible"">6194#37075</span><span class=""ellipsis""></span></a> "
