发布时间,问题,回答
1335339883,“开开”和“Hacker News”都使用“ karma”值。 karma值给出的是什么信息？其他网站有在用吗？,"Karma 制，可以理解为国内常用的「积分制」。Karma 值，就是「积分」。<br><br>Karma，来源是梵语 कर्म ，亦即中文佛教用语中的「业」。<blockquote>业力是指个人过去、现在或将来的行为所引发的结果的集合，业力的结果会主导现在及将来的经历，所以，个人的生命经历及他人的遭遇均是受自己的行为影响。因此，个人有为自己生命负责的可能性以及责任。而业力也是主导轮回的因，所以业力不单是现世的结果，还会生生不息地延伸至来世。</blockquote>——维基百科：业 <a href=""https://link.zhihu.com/?target=http%3A//zh.wikipedia.org/wiki/%25E6%25A5%25AD"" class="" external"" target=""_blank"" rel=""nofollow noreferrer""><span class=""invisible"">http://</span><span class=""visible"">zh.wikipedia.org/wiki/%</span><span class=""invisible"">E6%A5%AD</span><span class=""ellipsis""></span></a><br><br>由此可见，用户积累 karma 值，也就是「积业」，也就是「攒人品」。"
1335420711,英语为何没有「您」这个词？,"给@鼓鼓 知友提供一些补充——<br><br><b>You 成为 thou 的敬语，是直到近代英语时期才出现的。</b><br><ol><li>古英语（Old English）中，<i>thou</i> 是第二人称单数的主格，其对应的复数主格是 <i>ge</i> 或 <i>ȝe</i>，读音近似于现代英语的 <i>yea</i>（耶！）。thou 的宾格是 <i>eow</i>。</li><li>到了中古英语（Middle English），复数主格 <i>ge</i> 或 <i>ȝe</i> 变化为 ye，宾格 eow 和与格合并成为间接格 you。</li><li>到了近代英语（Early Modern English），由于诺曼征服，说法语的人统治了英国，法语中“使用第二人称复数代词（你们）来表示第二人称单数敬语（您）”的习惯被带入英语，于是，thou 的复数 ye 被用作敬语。<br></li><li>在同一时期，ye 被普遍化（generalized）为 you。从此，you 的主格和宾格（间接格）合并为一体。[1]<br></li></ol><br>补充：用复数形态来表示单数敬语，在语言中叫 <b>T-V distinction</b>。此概念由 1960 年的学者 Brown 和 Gilman 提出，他们将第二人称单数分为两种形态：T 形态（T-form）和 V 形态（V-form），前者在非正式场合、尊称呼卑、关系亲密的人之间使用，后者在正式场合、下级称呼上级、称呼陌生人的时候使用。[2]<br><br>[1] Wikipedia: You <a href=""https://link.zhihu.com/?target=http%3A//en.wikipedia.org/wiki/You%23Etymology"" class="" external"" target=""_blank"" rel=""nofollow noreferrer""><span class=""invisible"">http://</span><span class=""visible"">en.wikipedia.org/wiki/Y</span><span class=""invisible"">ou#Etymology</span><span class=""ellipsis""></span></a><br>[2] Wikipedia: T-V distinction <a href=""https://link.zhihu.com/?target=http%3A//en.wikipedia.org/wiki/T%25E2%2580%2593V_distinction"" class="" external"" target=""_blank"" rel=""nofollow noreferrer""><span class=""invisible"">http://</span><span class=""visible"">en.wikipedia.org/wiki/T</span><span class=""invisible"">%E2%80%93V_distinction</span><span class=""ellipsis""></span></a>"
1335445779,马克扎克伯格用什么手机？,"2010 年 6 月，在美国科技博客圈盛传了一个截屏，是扎克伯格在自己的 Facebook 主页上留的言，但很快他自己便删掉了这条。根据截屏的留言内容，以及下面的评论（还有他本人的回复），可以得知——<ul><li>在那个时候，扎克伯格先是使用的 BlackBerry</li><li>然后换用了一个星期的 iPhone 3GS</li><li>然后很不爽 iPhone 3GS 的电池寿命太短并且信号不好</li><li>然后又换用了 Android。</li></ul><figure><noscript><img src=""https://pic2.zhimg.com/50/af3d196e77d7202bc01f93c0f26467c7_720w.jpg?source=c8b7c179"" data-rawwidth=""500"" data-rawheight=""332"" class=""origin_image zh-lightbox-thumb"" width=""500"" data-original=""https://pic4.zhimg.com/af3d196e77d7202bc01f93c0f26467c7_720w.jpg?source=c8b7c179""></noscript><img src=""data:image/svg+xml;utf8,&lt;svg%20xmlns='http://www.w3.org/2000/svg'%20width='500'%20height='332'&gt;&lt;/svg&gt;"" data-rawwidth=""500"" data-rawheight=""332"" class=""origin_image zh-lightbox-thumb lazy"" width=""500"" data-original=""https://pic4.zhimg.com/af3d196e77d7202bc01f93c0f26467c7_720w.jpg?source=c8b7c179"" data-actualsrc=""https://pic2.zhimg.com/50/af3d196e77d7202bc01f93c0f26467c7_720w.jpg?source=c8b7c179""></figure>[图片来源：Business Insider <a href=""https://link.zhihu.com/?target=http%3A//www.businessinsider.com/mark-zuckerberg-disses-the-iphone-2010-6"" class="" external"" target=""_blank"" rel=""nofollow noreferrer""><span class=""invisible"">http://www.</span><span class=""visible"">businessinsider.com/mar</span><span class=""invisible"">k-zuckerberg-disses-the-iphone-2010-6</span><span class=""ellipsis""></span></a>]<br><br>从那以后，媒体和博客圈再也没有关于扎克伯格用什么手机的消息。不过，你觉得，他这样的人，左手 iPhone 右手 Android，应该不奇怪吧？"
1336035711,为什么大型电商都会选择图书行业？,我补充几个京东卖图书的原因：<br>1. 图书面向的是高知人群，在收入和年龄上都是京东的理想目标用户。<br>2. 图书是内容类商品，适合未来在用户之间做社会化连接。<br>3. 图书的购买频次比 3C 商品高。<br>4. 图书的购买者忠诚度比 3C 商品高。
1336067588,知乎上怎么贴图？,"<figure><noscript><img src=""https://pic1.zhimg.com/50/4c9258efa088a092a14dc9d75377c2e6_720w.jpg?source=c8b7c179"" data-rawwidth=""624"" data-rawheight=""214"" class=""origin_image zh-lightbox-thumb"" width=""624"" data-original=""https://pic4.zhimg.com/4c9258efa088a092a14dc9d75377c2e6_720w.jpg?source=c8b7c179""></noscript><img src=""data:image/svg+xml;utf8,&lt;svg%20xmlns='http://www.w3.org/2000/svg'%20width='624'%20height='214'&gt;&lt;/svg&gt;"" data-rawwidth=""624"" data-rawheight=""214"" class=""origin_image zh-lightbox-thumb lazy"" width=""624"" data-original=""https://pic4.zhimg.com/4c9258efa088a092a14dc9d75377c2e6_720w.jpg?source=c8b7c179"" data-actualsrc=""https://pic1.zhimg.com/50/4c9258efa088a092a14dc9d75377c2e6_720w.jpg?source=c8b7c179""></figure>"
1336406122,财经天下周刊用我和一些知乎网友的答案，可否与知乎官方有合作协议？或者遵守版权协议？,"知乎用户创造的内容，在所有权上遵从知识共享（CC）协议 [1]。其中，用户的回答，使用 CC 协议的六种协议中的一种，但不管是哪一种，转载方都必须在开头显著位置注明原作者、原出处，并与原文建立链接。<br><br>如果用户选择的是「非商业使用」[2]，那么，商业媒体转载必须单独取得作者授权。<br><br>知乎尚未与《财经天下周刊》建立合作。但，即使是与知乎有合作的商业媒体，在使用用户的回答时，仍然需要遵照上述准则。<br><br>[1] 知乎协议（<a href=""http://www.zhihu.com/terms#sec2"" class=""internal""><span class=""invisible"">http://www.</span><span class=""visible"">zhihu.com/terms#</span><span class=""invisible"">sec2</span><span class=""ellipsis""></span></a>）——<blockquote>用户在知乎上发布的全部原创回答，版权归作者所有。<br></blockquote>[2] 非商业使用，包括「署名-非商业使用-禁止演绎」、「署名-非商业使用-相同方式共享」和「署名-非商业使用」"
1336544509,知乎是否应对寻医问药类问题做区别对待？,"把“求医问药”拆成两部分来说，我们的想法是——<br><br>短答案：要科普，不要个案。<br><br>中答案：<ol><li>知乎适合做医学科普，并且我们也希望知乎能变成医学从业者向大众普及知识的平台。<br></li><li>但知乎上不适合做针对具体病情的、非常个人化和场景化的诊断建议，也不适合寻求这样的建议。<br></li></ol><br>长答案：<br><br><b>为什么知乎上不适合寻求针对具体病情的询医行为？</b><ul><li>从法律上，医学上，情理上都不合适，<b>有病去医院</b>，这是最靠谱的。</li><li>医学个案的最佳答案，永远是“去医院”。如果在知乎上提出医学个案的问题，对提问者来说，既浪费了宝贵的看病时间，还容易出现一些误导性答案导致患者病情恶化。<br></li><li><b>知乎会如何进行干预</b>：对于医学个案类问题，由于上述两条原因，不适合在知乎提出，为避免对更多人带来误导，个案类问题会被删除。希望大家理解，也欢迎大家对此类问题进行举报。</li></ul><br><b>为什么说知乎上适合做医学科普</b><br><ul><li>可以消除信息不对称。大众对医学常识是缺乏的，盲目崇拜某一类未经验证的说法、对保健品的过度迷信、生活中的错误医学观念、一些本可以避免的病症等等，都可以通过科普来解决。<br></li><li>建立一个良好的医生和非医生沟通机制，也是目前能够缓解医患矛盾的一种方法。当患者对一些医学常识有一定了解时，必然不会那些违反科学的愿望（诸如发烧就要输液、侧切就是医生想赚钱等等），从而在一定程度上缓解医患矛盾。<br></li></ul><br><b>科普和询医的界线在哪里？</b><ul><li><b>科普和询医，两者之间最根本的界线</b>在于：科普具有<u>广泛适应性</u>，比如“抗生素滥用会造成哪些危害？”，比如“手术时是否都需要全麻？”，比如“烫伤的常见处理方式？”而询医类问题都是个案，所谓个案，就是只能针对患者本人的具体病情和具体场景去进行专业诊断。</li><li>精神类问题、感冒、烫伤等问题，有些看似个案，但具有广泛适应性，其实是科普问题，诸如“精神分裂症可以治愈吗？治疗和缓解该病具体有什么思想和方向？”这是对精神类疾病的科普，帮助更多人主动去治疗，而个案问题则是“我得了精神分裂症，需要服用哪些药物？进行哪些治疗？”<br></li></ul><br>延伸阅读：<b>适不适合在知乎上提出与自身疾病相关的医学问题？</b> <a href=""http://www.zhihu.com/question/19879958"" class=""internal""><span class=""invisible"">http://www.</span><span class=""visible"">zhihu.com/question/1987</span><span class=""invisible"">9958</span><span class=""ellipsis""></span></a>"
1336567860,知乎可以用来约炮么？,"<b>基础篇</b><br><br>知乎，作为一个鼓励和倡导人们展示出专业、认真一面的知识社区，毫无疑问对任何人来说都是找到和发现自己心仪对象的最佳场所。<br><br><b>技巧篇</b><br><br>但是，就技巧而言，最好也同样通过展示你有头脑、乐助人的一面，让吸引你的人也对你产生兴趣。和现实世界一样，如果冒昧地表示好感，要做好被拒绝的准备；如果粗鲁地提出交友甚至性爱需求，就要承担被当作骚扰以至被举报的风险。<b><br><br>规范篇</b><br><br>不可提约炮问题，不可在回答、评论中公开约炮。<br>私信约炮，有账号被停用的风险。<br><br>1. 如果提出一个不限定回答对象的、公开的约炮问题，那么，这会被视作寻人/征友/召集类问题而被删除。<br>规范：<b>招聘 / 求职、交易 / 合作、寻人 / 征友、召集 / 赠送类内容 </b>会被删除<br>参见：<a href=""http://www.zhihu.com/question/19553510"" class=""internal"">知乎上哪些类型的内容会被删除？</a> 第四条<br><br>2. 如果提出一个限定回答对象的、一对一的约炮问题，那么，这会被视作令他人难堪的问题而被删除。<br>规范：<b>羞辱、谩骂、人身攻击、使用不文明用语等破坏知乎社区良好氛围，令其他用户不悦或者难堪的内容 </b>会被删除 <br>参见：<a href=""http://www.zhihu.com/question/19553510"" class=""internal"">知乎上哪些类型的内容会被删除？</a> 第八条<br><br>3. 如果私信对方，提出约炮请求，接收到此种私信的用户可以向知乎管理员进行举报，知乎管理员一旦接到举报并查证后，会将其视作侵犯他人的行为，立即停用该用户的账号。<br>规范：<b>知乎上不允许侵犯知乎用户或他人权益的行为和内容</b><br>参见：<a href=""http://www.zhihu.com/question/19790711"" class=""internal"">知乎的内容管理规范有哪些？</a> 第二条"
1336679197,用户个人自行判定问题并归入自建「脑残」收藏夹同时明确通告的做法是否可取？,"感谢大家对此问题的关注，以及这个问题后面所体现的更多值得思考的东西。<br><br>大家所关心的几件事情，我做一下回应。<br><br><b>收藏功能的改进</b><br><br>1. 知乎会改进收藏功能，很快就可收藏问题。<br><br><b>收藏夹名适用的规范</b><br><br>2. 收藏夹是个人化的，也是个性化的，它不是话题结构，因此收藏夹的名字，不需要话题名那样细致的语法规范 <i>[1]</i>。<br><br>3. 但，知乎上的一切内容都应符合社区原则 <i>[2]</i> 和社区用户行为和内容管理规范 <i>[3]</i>。<br><br>4. 「脑残类问题」作为收藏夹名，如果是私密收藏夹，那社区和管理员都无权干涉。但如果是公开并收录了答案，那就违反了社区的「友善」原则，以及违反了用户行为和内容管理规范中「知乎不允许侵犯知乎用户或他人权益的行为和内容」。这种公开的收藏夹是会被要求改名的，请理解。<br><br><b>恶意，且答非所问</b><br><br>5. 用户建立不友善的收藏夹之后，还去发布到别人回答里，这更是进一步违反社区的「友善」原则，并且是「恶意攻击、辱骂、诽谤、骚扰他人」的行为。用户若有这类行为，被举报后，将会受到处罚。<br><br>6. 我们能理解，在收藏功能完善之前，用户通过回答来收录问题的做法是不得已，并且我们也能看到这种做法的创造性。但，这并不能掩盖其「答非所问」的特征，更不是用户可以使用恶意名字公示之的理由。即便是不得已，答完之后就求折叠，那用「糟糕的问题」是否也比「脑残类问题」更能显出尊重、理性和宽容？<br><br>最后，很感谢这么多知友都能理解和维护这个社区所尊崇的理念。很多同学的回答我都赞同或感谢了。<br><br>[1] 知乎的话题名规范：<a href=""http://www.zhihu.com/question/19581435"" class=""internal""><span class=""invisible"">http://www.</span><span class=""visible"">zhihu.com/question/1958</span><span class=""invisible"">1435</span><span class=""ellipsis""></span></a><br>[2] 知乎的社区基本原则 <a href=""http://www.zhihu.com/question/20133162"" class=""internal""><span class=""invisible"">http://www.</span><span class=""visible"">zhihu.com/question/2013</span><span class=""invisible"">3162</span><span class=""ellipsis""></span></a><br>[3] 知乎用户行为和内容管理规范 <a href=""http://www.zhihu.com/question/19790711"" class=""internal""><span class=""invisible"">http://www.</span><span class=""visible"">zhihu.com/question/1979</span><span class=""invisible"">0711</span><span class=""ellipsis""></span></a>"
1336842191,抢注天猫商城一个准备发力的女装品牌的 .com 域名，有价值吗？,没多大价值。<br><br>1. 中文域名：四拼域名，没价值。除非这公司老板被人洗脑或催眠了（当然也不排除老板自以为是的可能），否则这个名字肯定要改。B2C 网站，如果纯做线上生意，四拼域名带来的主动访客损失是巨大的，品牌建设的成本也很高。你主动访问过哪个四拼域名的网站？<br><br>2. 英文域名：更没价值。除非这个品牌做国外市场，并且真正投入大量营销成本去做，否则，其英文品牌名，只能满足老板附庸风雅的心理，没有任何国内消费者会记住一个国内品牌的英文名。你会正确拼写美特斯邦威的英文名吗？更何况，这种原因产生的英文名，通常都是自造的一个看起来很洋气、实际狗屁不通的英文词，不光中国人记不住，外国人也记不住。<br><br>当然，只要能忽悠，能说服大老板买单，什么东西都能卖出「价钱」来。但这就和提问和回答中的「价值」无关了。
1336843542,哪里能找到阿根廷导演费尔南多 · 索拉纳斯 1998 年拍的《云》（La Nube）？,"淘宝购买链接：<a href=""https://link.zhihu.com/?target=http%3A//s.taobao.com/search%3Fq%3DLa%2Bnube%26commend%3Dall%26ssid%3Ds5-e%26search_type%3Ditem%26sourceId%3Dtb.index%26initiative_id%3Dtbindexz_20120513"" class="" external"" target=""_blank"" rel=""nofollow noreferrer""><span class=""invisible"">http://</span><span class=""visible"">s.taobao.com/search?</span><span class=""invisible"">q=La+nube&amp;commend=all&amp;ssid=s5-e&amp;search_type=item&amp;sourceId=tb.index&amp;initiative_id=tbindexz_20120513</span><span class=""ellipsis""></span></a>"
1337324645,人死后知乎账户如何处理？,"我们将用户在知乎上的账户，视作用户的个人财产。<br><br>我们将用户通过自己的账户在知乎上创建的、拥有完全著作权的内容 <i>[1]</i>，也视为用户的个人财产。<br><br>因此，用户在知乎上的账户，以及通过这个账户创建的、拥有完全著作权的内容，都和用户的其他财产一样，依据相关的法律，可以进行继承。<i>[2]</i><br><br>但是，由于知乎上不接受用户冒名使用账号，因此，继承人对所继承的账户，以及拥有完全著作权的内容，拥有处置权 <i>[3]</i>，但不应再使用这个账号进行相关的活动 <i>[4]</i>。<br><br>——注释——<br><br>[1] 知乎上的「问题」和「话题」是公共编辑的，不属于个人所有，因此，用户拥有完全著作权的内容，目前主要是「回答」、「评论」、「收藏」和「私信」。<br><br>[2] 这里的唯一问题，就是如何确定继承人身份。关于此，律师@Raymond Wang 在另一个问题里提供了相关的思考，参见 <a href=""http://www.zhihu.com/question/19881554/answer/13242912"" class=""internal""><span class=""invisible"">http://www.</span><span class=""visible"">zhihu.com/question/1988</span><span class=""invisible"">1554/answer/13242912</span><span class=""ellipsis""></span></a><br><br>[3] 处置权，主要是针对所继承的内容选择进行删除、保留、修改授权方式和转授权的权利。<br><br>[4] 相关活动包括提问、回答、评论、私信、收藏、赞同、感谢、编辑等。"
1337347802,知乎会不会被腾讯收购？,"不会。<br><br>延伸阅读：<br><ul><li><b>腾讯收购知乎会怎么样？</b> 5 个答案 <a href=""http://www.zhihu.com/question/19670049"" class=""internal""><span class=""invisible"">http://www.</span><span class=""visible"">zhihu.com/question/1967</span><span class=""invisible"">0049</span><span class=""ellipsis""></span></a></li><li><b>知乎是腾讯的？</b> 7 个答案 <a href=""http://www.zhihu.com/question/20242100"" class=""internal""><span class=""invisible"">http://www.</span><span class=""visible"">zhihu.com/question/2024</span><span class=""invisible"">2100</span><span class=""ellipsis""></span></a></li><li><b>知乎被新浪收购了吗？</b> 8 个答案 <a href=""http://www.zhihu.com/question/19888550"" class=""internal""><span class=""invisible"">http://www.</span><span class=""visible"">zhihu.com/question/1988</span><span class=""invisible"">8550</span><span class=""ellipsis""></span></a></li><li><b>如果知乎被微软收购加入到必应会如何？</b> 还没有答案 <a href=""http://www.zhihu.com/question/19919079"" class=""internal""><span class=""invisible"">http://www.</span><span class=""visible"">zhihu.com/question/1991</span><span class=""invisible"">9079</span><span class=""ellipsis""></span></a></li><li><b>百度为什么不收购知乎？</b> 14 个答案 <a href=""http://www.zhihu.com/question/19648233"" class=""internal""><span class=""invisible"">http://www.</span><span class=""visible"">zhihu.com/question/1964</span><span class=""invisible"">8233</span><span class=""ellipsis""></span></a></li><li><b>如果知乎被收购，谁将是可能性最大的潜在买家？</b> 14 个答案 <a href=""http://www.zhihu.com/question/19912389"" class=""internal""><span class=""invisible"">http://www.</span><span class=""visible"">zhihu.com/question/1991</span><span class=""invisible"">2389</span><span class=""ellipsis""></span></a></li><li><b>Quora 有可能收购或者投资知乎吗？如果有，知乎是否应该接受？为什么？</b> 1 个答案 <a href=""http://www.zhihu.com/question/20022275"" class=""internal""><span class=""invisible"">http://www.</span><span class=""visible"">zhihu.com/question/2002</span><span class=""invisible"">2275</span><span class=""ellipsis""></span></a></li></ul><br>查看更多，可搜索「知乎收购」： <a href=""http://www.zhihu.com/search?q=%E7%9F%A5%E4%B9%8E%E6%94%B6%E8%B4%AD"" class=""internal""><span class=""invisible"">http://www.</span><span class=""visible"">zhihu.com/search?</span><span class=""invisible"">q=%E7%9F%A5%E4%B9%8E%E6%94%B6%E8%B4%AD</span><span class=""ellipsis""></span></a>"
1337419893,如何终止暧昧？,姑且认为提问者不是在炫耀，而是真诚地想要终止暧昧状态，但不知道怎么做。基于这个前提，下面是我的回答——<br><br>信号。<br><br>信号！<br><br>注意你发出的信号！<br><br>我向来认为，「我并没有这个意思，但对方却误以为我想要怎么样」这种说法，几乎都是不可接受的。<br><br>在二人间的浪漫关系上，这个世界上没有「误解」这个东西，只有错误发出的信号。<br><br>错误地让对方以为「他/她对我有意思」；<br>错误地让对方以为「他/她喜欢我，只是不敢对我表白」；<br>错误地让对方以为「他/她对我有好感，但碍于各种原因，不能往下发展」；<br>错误地让对方以为「他/她和我想发展一些微妙的情感关系」；<br>错误地让对方以为「他/她也不想和我有什么长远未来，只是愿意保持一些非承诺性的亲密行为」。<br><br>如果对方错误理解了你的意思，那么，原因只有三个——<ol><li>你懂得如何发出正确的信号，你只是<b>故意发出了错误的信号</b>。</li><li>你懂得如何发出正确的信号，但你不够成熟，<b>没有控制好应该发出怎样的信号</b>。</li><li>你<b>不懂如何发出正确的信号</b>，你根本没有意识你发出了错误的信号。</li></ol><br>要解决这个问题，双方都有责任通过自己的行动来明确：<ul><li>我要更清晰地让对方知道，我是什么想法。或者——</li><li>我要让对方更清晰地表明，他/她是什么想法。</li></ul><br>我向来鼓励身边的朋友主动解决问题，而非被动等待问题自己解决或由别人解决，因此，请你，主动地，把错误的或者不清晰的信号，以更清晰的方式传递给对方。<br><br>如果正确无误地传递了「否」的信号，对方仍然抱有错误的理解或幻想，那么，你需要做的是，继续强化这个「否」信号，直到对方理解。<br><br>当然，对方接收到了你传递的「否」信号，不一定等于对方就不纠缠你了，但同样地，如果你不希望继续纠缠下去，那么你仍然要继续明确、有力地发出「不想继续纠缠」的信号。<br><br>想要传递明确无误的「否」信号，建议采取下列行为：<ul><li>尽可能让两人之间的沟通行为在公共场合发生。如果有不得已需要一对一沟通的场合，那么就要——</li><li>降低一对一沟通的频率</li><ul><li>区分不同沟通方式的亲密度，避免高亲密度的沟通行为。</li><li>沟通行为的亲密度最高的就是见面，一对一的见面。要尽可能避免。</li><li>其他所有能够提供一对一沟通的工具（邮件、短信、微信、微博私信、知乎私信……）也要降低使用的频率。</li></ul><li>一对一沟通的内容要精简</li><ul><li>如果一对一沟通，要尽可能简短，话越多，越容易说不清楚。</li><li>尽可能不要勾起对方的谈话欲。</li><li>避免谈及个人生活。</li></ul><li>避免在一对一沟通中暗示任何亲密感</li><ul><li>避免使用任何有亲密感的言辞。</li><li>避免任何肢体接触。</li><li>避免不必要的眼神接触。（也就是说，少看对方！）</li></ul><li>不要没事招对方。（比如：微博@对方，与对方不相关的邮件 CC 对方，在知乎上邀请对方回答，找机会偷偷看对方，等等）</li></ul><br>上面的若干建议，如果把所有的「避免」、「不要」去掉，基本上就是「如何勾引对方」的教程了。关于后者，以后有机会，我再慢慢跟大家分享吧。今天先把问题解决到这里。
