发布时间,问题,回答
1292862004,中国有多少家 Apple Store 零售店？,目前有六家：北京两家，上海三家，香港一家。       <br><br>第一家是北京三里屯店，2008 年 7 月开业。      <br>第二家是上海浦东陆家嘴店，2010 年 7 月开业。      <br>第三和第四家同日开业，分别是北京西单大悦城店，和上海淮海中路香港广场店，2010 年 9 月开业。       <br> 第五家是上海南京东路店，2011 年 9 月 23 日开业。      <br>第六家是香港中环店，2011 年 9 月 24 日开业。       <br><br>据负责零售店业务的苹果高级副总裁朗·约翰森（Ron Johnson）在 2010 年 2 月 25 日的苹果公司年度股东大会上说，苹果将在接下来的两年内（也就是在 2012 年 2 月底之前）在大中华区开设 25 个门店。据分析，其中应该会包括北京上海之外的其他大陆城市，以及香港和台北。
1292865614,关于史蒂夫·乔布斯的最好的传记是哪几本？,"<b>《史蒂夫·乔布斯传》</b>，作者：沃尔特·艾萨克森    <br><i>Steve Jobs</i>, by Walter Isaacson    <br> 豆瓣链接: <a href=""https://link.zhihu.com/?target=http%3A//book.douban.com/subject/6798611/"" class="" external"" target=""_blank"" rel=""nofollow noreferrer""><span class=""invisible"">http://</span><span class=""visible"">book.douban.com/subject</span><span class=""invisible"">/6798611/</span><span class=""ellipsis""></span></a>    <br><b> </b><b> </b>  <br> 《重返小王国：乔布斯如何改变世界》，作者：迈克尔·莫瑞茨   <br><i>Return to the Little Kingdom</i>, by Michael Moritz   <br>豆瓣链接: <a href=""https://link.zhihu.com/?target=http%3A//book.douban.com/subject/5400552/"" class="" external"" target=""_blank"" rel=""nofollow noreferrer""><span class=""invisible"">http://</span><span class=""visible"">book.douban.com/subject</span><span class=""invisible"">/5400552/</span><span class=""ellipsis""></span></a>   <br><br><b>《史蒂夫·乔布斯复出记》</b>，作者：艾伦·多伊奇曼   <br><i>The Second Coming of Steve Jobs</i>, by Alan Deutschman   <br>豆瓣链接: <a href=""https://link.zhihu.com/?target=http%3A//book.douban.com/subject/1292273/"" class="" external"" target=""_blank"" rel=""nofollow noreferrer""><span class=""invisible"">http://</span><span class=""visible"">book.douban.com/subject</span><span class=""invisible"">/1292273/</span><span class=""ellipsis""></span></a>    <br><br><b>《完美之物》</b>，作者：史蒂文·列维   <br><i>The Perfect Thing</i>, by Steven Levy   <br>豆瓣链接: <a href=""https://link.zhihu.com/?target=http%3A//book.douban.com/subject/2269898/"" class="" external"" target=""_blank"" rel=""nofollow noreferrer""><span class=""invisible"">http://</span><span class=""visible"">book.douban.com/subject</span><span class=""invisible"">/2269898/</span><span class=""ellipsis""></span></a>   <br><br><b>《苹果往事》</b>，作者：安迪·赫茨菲尔德   <br><i>Revolution in the Valley</i>, by Andy Hertzfeld   <br>豆瓣链接: <a href=""https://link.zhihu.com/?target=http%3A//book.douban.com/subject/4214837/"" class="" external"" target=""_blank"" rel=""nofollow noreferrer""><span class=""invisible"">http://</span><span class=""visible"">book.douban.com/subject</span><span class=""invisible"">/4214837/</span><span class=""ellipsis""></span></a>   <br><br><b>《撬开苹果》</b>，作者：利安德·卡尼   <br><i>Inside Steve's Brain</i>, by Leander Kahney   <br>豆瓣链接: <a href=""https://link.zhihu.com/?target=http%3A//book.douban.com/subject/3309579/"" class="" external"" target=""_blank"" rel=""nofollow noreferrer""><span class=""invisible"">http://</span><span class=""visible"">book.douban.com/subject</span><span class=""invisible"">/3309579/</span><span class=""ellipsis""></span></a>   <br><br><i><b>Insanely Great</b></i>, by Steven Levy   <br>无中文版，豆瓣链接: <a href=""https://link.zhihu.com/?target=http%3A//book.douban.com/subject/1341633/"" class="" external"" target=""_blank"" rel=""nofollow noreferrer""><span class=""invisible"">http://</span><span class=""visible"">book.douban.com/subject</span><span class=""invisible"">/1341633/</span><span class=""ellipsis""></span></a>"
1292951425,如何读「repoussé」这个法文单词？,"国际音标：ʁe-pu-se' ，重音在最后一个音节上。发音示范: <a href=""https://link.zhihu.com/?target=http%3A//goo.gl/0TnRn"" class="" external"" target=""_blank"" rel=""nofollow noreferrer""><span class=""invisible"">http://</span><span class=""visible"">goo.gl/0TnRn</span><span class=""invisible""></span></a>    <br><br>汉语读音类似于：何-布-塞 (sei)。      <br><br>此系法语词——      <br><ul><li>法语 ""r"" 是浊小舌音，@梁海 说，在巴黎法语中是小舌颤音，发音类似汉语 ""h""，但伴有小舌震动。      <br></li><li>法语 ""re-"" 开头的词，一般是前缀，""e"" 弱读，听起来就像是没有发一样。</li><li>法语 ""p"" 是清不送气爆破音，发音类似汉语的 ""b""，而非英语的 ""p""。</li><li>法语 ""ou"" 发音类似于英语的 “oo""。</li><li>法语 ""ss"" 发音为 ""s""。</li><li>法语 ""é"" 是加了闭音符的 “e”，发音类似于英语的 ""eh""，类似于汉语中的 ""ei""。</li></ul>"
1293041363,iOS 系统上你最喜欢的音乐类软件是什么？为什么？,"【 8/29/2012 更新】<br><br>我不能说下面的是 iPhone 上最好的音乐应用，但至少是迄今为止我最喜欢的 iPhone 音乐应用。<br><ul><li><b>exfm</b>——ex.fm 要解决的问题就是，如果你觉得很久没有人给你推荐什么歌好听了，那么，ex.fm 就会让你知道——顿一下——什么样的节奏是最呀最摇摆。<br>【价格：免费。下载链接: <a href=""https://link.zhihu.com/?target=http%3A//itunes.apple.com/app/exfm/id440394777"" class="" external"" target=""_blank"" rel=""nofollow noreferrer""><span class=""invisible"">http://</span><span class=""visible"">itunes.apple.com/app/ex</span><span class=""invisible"">fm/id440394777</span><span class=""ellipsis""></span></a>】</li><li><b>Remote</b>——我每日必用软件，可以通过 iPhone 来遥控操作桌面 iTunes 几乎所有的播放功能，实时的分类浏览，封面展示，甚至还可以搜索，强大至极。<br>【价格：免费。下载链接: <a href=""https://link.zhihu.com/?target=http%3A//itunes.apple.com/app/remote/id284417350"" class="" external"" target=""_blank"" rel=""nofollow noreferrer""><span class=""invisible"">http://</span><span class=""visible"">itunes.apple.com/app/re</span><span class=""invisible"">mote/id284417350</span><span class=""ellipsis""></span></a>】</li></ul><ul><li><b>My Artists</b>——软件启动后，乍一看，还以为不过是 iPhone 自带的 iPod 应用中「按表演者浏览」的列表功能，但其实强大的地方是：1）点开一个表演者，会进入一个界面，呈现出这个表演者的简介，他/她在本机曲库中的专辑，以及系统推荐的该表演者的其他专辑；2）点开推荐的专辑，还可以试听其中的曲目；3）如果 iPod 应用正在播放一首歌，这个软件还可以显示正在播放的这个表演者的信息。对于音乐爱好者来说，非常非常好用。<br>【价格: 2.99美元。下载链接: <a href=""https://link.zhihu.com/?target=http%3A//itunes.apple.com/app/my-artists/id365565608"" class="" external"" target=""_blank"" rel=""nofollow noreferrer""><span class=""invisible"">http://</span><span class=""visible"">itunes.apple.com/app/my</span><span class=""invisible"">-artists/id365565608</span><span class=""ellipsis""></span></a>】</li></ul><ul><li><b>DJinn</b>——神奇的应用！神奇之一：这款应用根据你的风格需求，自动实时生成的音乐，目前提供 Aquatic、Aquazen、Rasta、Chill Out 和 Soft House 五种风格选择，你还可以把生成的曲子保存下来，便于以后播放，因为下次再选择，系统会生成新的音乐了。神奇之二：系统生成的音乐，无论音质还是好听程度，都相当高。没事的时候，放来做背景音乐，很赞！神奇之三：这个公司垮了，苹果也因此将这款应用下了架。抱歉我吊了大家的胃口……</li></ul><ul><li><b>Tango Remote</b>——苹果那款遥控器，是用 iOS 设备遥控桌面 iTunes 曲库播放，而这个应用，则是用 iOS 设备来遥控另一台 iOS 设备上的曲库播放操作。<br>【价格: 4.99 美元。下载链接: <a href=""https://link.zhihu.com/?target=http%3A//itunes.apple.com/app/tango-remote-control-music/id345279970"" class="" external"" target=""_blank"" rel=""nofollow noreferrer""><span class=""invisible"">http://</span><span class=""visible"">itunes.apple.com/app/ta</span><span class=""invisible"">ngo-remote-control-music/id345279970</span><span class=""ellipsis""></span></a>】</li></ul><ul><li><b>Soundtrcker Radio</b>——社会化的 Pandora。支持 iOS 4.2 的多任务后台播放。<br>【价格：免费。下载链接: <a href=""https://link.zhihu.com/?target=http%3A//itunes.apple.com/app/soundtrckr/id339473336"" class="" external"" target=""_blank"" rel=""nofollow noreferrer""><span class=""invisible"">http://</span><span class=""visible"">itunes.apple.com/app/so</span><span class=""invisible"">undtrckr/id339473336</span><span class=""ellipsis""></span></a>】</li></ul><ul><li><b>Buddha Machine</b>——中国 DJ 团队 FM3 出品的音乐应用，内置了 FM3 创作的「唱佛机」Loop。极简主义界面，只有一个「随机播放下一首」按钮。很酷，很有趣，很好听。支持 iOS 4.2 多任务后台播放。<br>【价格: 0.99 美元。下载链接: <a href=""https://link.zhihu.com/?target=http%3A//itunes.apple.com/app/buddha-machine/id294730223"" class="" external"" target=""_blank"" rel=""nofollow noreferrer""><span class=""invisible"">http://</span><span class=""visible"">itunes.apple.com/app/bu</span><span class=""invisible"">ddha-machine/id294730223</span><span class=""ellipsis""></span></a>】</li></ul><ul><li><b>TuneWiki</b>——从服务器实时获取 iPod 曲库正在播放的歌曲的歌词。经典。<br>【价格：免费。已下架。】</li></ul><ul><li><b>Lyric Legend</b>——TuneWiki 团队出品，歌词游戏，玩法类似于 Tap Tap Revenge，只是玩家要摁的不是鼓点，而是歌词节奏。<br>【价格：免费。下载链接: <a href=""https://link.zhihu.com/?target=http%3A//itunes.apple.com/app/lyric-legend/id381473803"" class="" external"" target=""_blank"" rel=""nofollow noreferrer""><span class=""invisible"">http://</span><span class=""visible"">itunes.apple.com/app/ly</span><span class=""invisible"">ric-legend/id381473803</span><span class=""ellipsis""></span></a>】</li></ul><ul><li><b>豆瓣电台</b>——中国的 Pandora。<br>【价格：免费。下载链接: <a href=""https://link.zhihu.com/?target=http%3A//itunes.apple.com/app/douban-fm/id353732572"" class="" external"" target=""_blank"" rel=""nofollow noreferrer""><span class=""invisible"">http://</span><span class=""visible"">itunes.apple.com/app/do</span><span class=""invisible"">uban-fm/id353732572</span><span class=""ellipsis""></span></a>】</li></ul><ul><li><b>SoundHound</b>——著名的音乐识别应用。也许是先入为主的缘故吧，反正我就是觉得它比 Shazam 好。<br>【价格：免费。下载链接: <a href=""https://link.zhihu.com/?target=http%3A//itunes.apple.com/app/soundhound/id355554941"" class="" external"" target=""_blank"" rel=""nofollow noreferrer""><span class=""invisible"">http://</span><span class=""visible"">itunes.apple.com/app/so</span><span class=""invisible"">undhound/id355554941</span><span class=""ellipsis""></span></a>】</li></ul>"
1293041617,关于摇滚乐最好的纪录片或电影是什么？, 补充一个关于摇滚的——<br><ul><li>《海盗电台》（<i>The Boat That Rocks</i>）</li></ul><br>关于 Hip Hop 的——<br><ul><li>《川流熙攘》（<i>Hustle &amp; Flow</i>）</li><li>《8英里》（<i>8 Miles</i>）</li></ul>
1293042949,哪些歌曲曾经让你感动过并因此流泪？为什么？,"<ul><li><i><b>下一站天国</b></i>，黄耀明，专辑《光天化日》。唱给离开的人，但我听的时候，却想起了离世的人。每句歌词都给在世者带来痛苦和力量。<br>在线听: <a href=""https://link.zhihu.com/?target=http%3A//www.xiami.com/song/399017"" class="" external"" target=""_blank"" rel=""nofollow noreferrer""><span class=""invisible"">http://www.</span><span class=""visible"">xiami.com/song/399017</span><span class=""invisible""></span></a></li></ul><ul><li><i><b>Thank You</b></i>, Robert Plant &amp; Jimmy Page，专辑《No Quarter》。这是现场版，Led Zeppelin 年迈聚首，遍插茱萸少一人，「If the sun refused to shine, I'll be loving you」这句唱得尤显悲怆。 <br>在线听: <a href=""https://link.zhihu.com/?target=http%3A//www.xiami.com/song/1803936"" class="" external"" target=""_blank"" rel=""nofollow noreferrer""><span class=""invisible"">http://www.</span><span class=""visible"">xiami.com/song/1803936</span><span class=""invisible""></span></a></li></ul><ul><li><i><b>Epitaph</b></i>, King Crimson, 专辑《In the Court of Crimson King》。【感谢 Lawrence Li 同学提醒！】<br>在线听：<a href=""https://link.zhihu.com/?target=http%3A//www.xiami.com/song/1769149932"" class="" external"" target=""_blank"" rel=""nofollow noreferrer""><span class=""invisible"">http://www.</span><span class=""visible"">xiami.com/song/17691499</span><span class=""invisible"">32</span><span class=""ellipsis""></span></a></li></ul>"
1293043360,App Store 上收入过 100 万美元的游戏开发者有哪些？, 上海的 Trinity，代表作为「游戏盒子」，下载超过 200 万份。<br><br>芬兰的 Rovio，代表作为「愤怒的小鸟」，iOS平台下载超过 1200 万份。 
1293097465,2010 年的游戏大作有哪些？, iOS 平台：《愤怒的小鸟》 
1293116269,如何让心智变强大？,<ul><li>降低对物质和金钱的需求和依赖</li><li>无论如何，保持正直</li><li>爱别人要随便，恨别人要慎重</li><li>记住好的事情，忘记不好的事情</li><li>以物喜，不以己悲</li><li>多阅读</li><li>多交人格正直、聪明智慧的朋友</li><li>随时敢下判断，但同时又随时准备修改自己先前的观点</li></ul>
1293117839,如果我想分享知识，可以自问自答吗？, 可以，并且这样做应该是得到鼓励的。<br><br>但同时，要想到这是一个社会化问答系统，每一个问题和回答的价值，在于有价值的参与。因此，你提给自己的问题，最好也能是开放性的，可以邀请朋友、或者你希望的人来回答的。 
1293118128,知乎是否会有话题审核制度？, 知乎必须有话题审核制度。<br><br>从愿景和价值观上，我们可以相信，「部分知识」等于「没有知识」。<br><br>但从务实、行动主义的角度看，即使是「部分知识」，但它只要是知识，就是有价值的。 
1293118398,对问答网站来说，更重要的是得到具体的答案还是得到每个人的反应？," 我认为，知乎这样一个社会化问答网站，人们提出问题所寻求的和得到的，不是事实陈述 (facts / statements), 而是个人化的「经验」、「认知」和「观察」 (experience / cognition / observations). 前者的代表是 Wikipedia。而我认为知乎这样的社会化问答网站未来是一个 Wikipedia 量级的产品，也正来源于这个比较。<br><br>因此，每个人参与的、有价值的回复，正是其魅力所在。 "
1293119656,在知乎问那些能通过搜索引擎找到答案的问题，是不是不好？,<ul><li>如果寻求的是一个<b>事实或数据</b>，那么这个问题所寻求的答案，最好是难以公开证明、需要相关背景的个人才能回答的。<br>例如——「苹果公司有多少人审核开发者上传的应用？」这个问题，没有公开资料，即使有也不一定可信，你希望的是真正了解内情的人能回答最可靠。</li></ul><br><ul><li>如果寻求的是<b>个人经验或观点</b>，那么这个问题所寻求的答案，最好是回答者的身份能给答案内容带来增值的，换言之，它最好不是一个投票类的问题，即使没有采用投票形式。<br>例如——「北京哪个搬家公司比较便宜？」这个问题，回答者的身份并不重要，那么在知乎这样的社会化问答网站上提问，很可能得不到有价值的答案。</li></ul>
1293121020,如何评价摇滚乐的好坏？, 音乐艺术，作为艺术的一种，评价好坏向来都是偏主观的，随着聆听者的个体经验、美学品味，以及时代精神（Zeitgeist）、风尚和社会的价值观而变化。<br><br>你既可以给定一堆评价指标，比如新颖的乐器、独特的演奏方法和技巧、演奏或编曲的复杂度、歌词写作水平、演唱技巧，等等。<br><br>但你也可以就用一句话来概括：真诚的，具有自我反省或社会觉醒意识的。<br><br>或者更简单一点：<b>能够打动你的</b>。<br><br>因此，很多优秀的摇滚音乐人，是不仅仅听摇滚的。对于同样保持开放性——与摇滚的反叛精神一致——的摇滚乐爱好者来说，同样可以被其他种类的好的音乐所打动，流行、嘻哈、爵士、电子，等等。<br><br>无论什么风格的流行音乐（让我们承认摇滚也是广义的流行音乐吧），他们的根源都是劳动号子，以及工间休息时调侃解闷的娱人小调。 
1293123088,Quora 没有，而你却想知乎要追加的功能/特性是什么？,<b>群邀请回答问题</b>：有些问题我想邀请一堆人回答，并且我想这也能增加病毒性传播，但现在的邀请是我只能一个一个地输入，而不是像开心/人人那样，列出我的好友，我划勾，然后群发出去。 
1293124338,为什么北京万通中心地下的汉舍餐厅墙上挂着那么多媒体人的照片？是谁拍的？, 渝乡人家的联合创始人朱溶，当年还在渝乡人家时，对渝乡人家几个新旗舰店的新颖、大胆的装修改造，很得一部分时尚媒体人士的赞赏，朱溶因此也与时任现代传播集团旗下《周末画报》北京城市版的副主编丁颖和集团北京分部摄影部主任高远结下友情。<br><br>朱溶创办汉舍后，邀请丁颖和高远夫妇为她的新餐厅装修设计参与提供创意，丁/高二人提议拍摄一系列以「人与食物」为主题的摄影作品，并将其陈列于餐厅四壁，朱溶欣然接受，委托二人操持此事。<br><br>丁颖和高远于是开始策划作品细节，认为挑选人、而非挑选食物是重点，于是他们圈出好友中表情和气质最富戏剧性的一些人，让他们提出自己喜爱的菜肴，准备之，并在高远的摄影棚内拍摄完成。<br><br>由于丁/高二人长年供职于媒体业，有很多要好的朋友都是同行，因此他们选中的人选中，也多为媒体人。但也有一些非媒体界的人士，比如高远的「义父」左小祖咒。 
1293124911,北京的好咖啡馆有哪些？, 我喜欢去的两家是——<br><ul><li>烟袋斜街 <b>海吧</b>。烟袋斜街地段很好，既可见后海湖光，又免受湖两岸酒馆密集的喧闹。夏天的午后去海吧三楼露台坐着尤其惬意，因为那里是北京少有的四周没有高楼阻挡阳光的去处。</li></ul><br><ul><li>五道口清华科技园的 <b>JF 咖啡</b>。曾是 SPR 咖啡的加盟店，后转让给付军剪艺的老板付军，遂改此名。我喜欢这家咖啡馆，不仅仅是在当时公司的楼下，因为五道口亦是咖啡馆云集之地，但这家 JF 咖啡室外座椅挨着绿地，室内可吸烟，Wi-Fi 速度很快。座位与座位之间的距离不远不近，刚刚好，即使是满座的热闹时候，也能不受影响地谈事情。当然，还有一个吸引我的地方是，他家的背景音乐是我提供的，因此换得每日一杯免费咖啡。</li></ul>
1293130982,苹果 App Store 一年的总销售额是多少？," 苹果在 App Store 和 iBookstore 上的收入从来不单独列出，都是和 iTunes Music Store 放在一起汇报。根据苹果提交给美国证券交易委员会（SEC）的10-K 文件，苹果 iTunes Store 业务（包括 Music, App 和 iBooks）在截至 2010 年 9 月 25 日的 2010 财年的总销售额是 41 亿美元，占当年全公司 652.25 亿美元总销售额的 6.3%。 "
1293249414,2010 年你看过的最好的电影是什么？,<ul><li>Inception</li><li>Toy Story 3</li><li>让子弹飞<br></li></ul>
1293292766,为什么早期知乎中的默认头像是一个很痛苦的表情？, 作为一个吸烟者，我对知乎的默认头像充满了亲切感。 
1293296589,macOS 上有哪些值得推荐的常用软件？, 同意陈青，没有什么软件是必装的，因人而异。下面列出的只是我一些个人推荐，简洁好用是我的一个重要偏好。<br><br>我在 Mac 上每天都会使用的——<br><ul><li><b>Chrome for Mac</b>：浏览器。无需多言。</li><li><b>MPlayerX</b>：视频播放。比 VLC 简洁，播放操作更好，多格式支持也很出色。</li><li><b>Dropbox</b> / <b>SugarSync</b>：文件同步。前者更优，后者功能不弱、只是用户体验稍逊。</li><li><b>QIM (IMKQIM)</b>：中文输入法。带搜狗拼音词库。</li><li><b>BetterZip</b>：解压缩工具。RAR 支持需要另下载官方命令行工具。</li><li><b>Gmail Notifr</b>：Gmail 邮件通知。支持多邮箱，包括 Google Apps 邮箱。</li><li><b>TunesArt</b>：在桌面显示 iTunes 正在播放的音乐专辑封面，以及曲名、专辑名、表演者等信息。</li></ul>使用频率略低一些的——<br><ul><li><b>Adium</b>：即时通讯。多协议，可定制外观。</li><li><b>Folx</b>：下载工具。</li><li><b>uTorrent</b>：BT 工具。</li><li><b>Cyberduck</b>：FTP 工具。更重要的是，还支持 Amazon S3。</li><li><b>AppZapper</b>：软件卸载工具。</li></ul>
1293297242,Quora 如何走出 IT 人社区的圈子？, 在稳固住高质量的 IT 社区用户的同时，逐步引入一小部分非 IT 人士，看看社区与他们之间的互动，以及他们的反馈，通过反复迭代来找到合适的路径。关雅荻、Talich 和张悦悦就是一个很好的开始，他们会自然拓展这里的话题，并且我们也鼓励其他种子用户积极讨论非 IT 话题。<br><br>事实上，目前知乎话题种类的多样性还是超出我的预料的。 
1293300443,iPad 拆箱后无法连接 iTunes 该怎么办？," 尝试下载最新版本的 iTunes。链接:  <a href=""https://link.zhihu.com/?target=http%3A//www.itunes.com/"" class="" external"" target=""_blank"" rel=""nofollow noreferrer""><span class=""invisible"">http://www.</span><span class=""visible"">itunes.com/</span><span class=""invisible""></span></a> "
1293302165,2011 年的移动互联网趋势是什么？, 移动互联网有一些内在属性是全新的，是传统 PC 互联网难以实现或难以放大其价值的，因此也是未来革命的星火燃点。我认为，其中能够促生变革的最重要三个新属性是——<br><br><ul><li><b>本地化（Local）</b></li></ul>　　手机天然能集成获取和呈现用户地理信息的功能。近年来在国内外都大热的 Groupon 模式的团购网站、Craiglist/百姓网/58同城等分类广告网站、Yelp/大众点评等本地生活类网站，已纷纷证明了本地商务/本地消费市场的庞大潜力。传统互联网和传统无线互联网上的主流应用，都可因为本地化属性变成新的东西。<br>　　例子：Loopt 将本地化引入了交友。大众点评手机版的实用性和使用频率比网页版更高。<br><br><ul><li><b>社会化（Social）</b></li></ul>　　可以简单粗暴地这么理解：一切移动的产品都必然是社会化的，一切社会化的产品都必然是移动的。社会化将成为未来移动互联网产品的重要组成要素，并且会因此催生出一些新兴的势力。<br>　　例子：Instagram 和 Flickr 手机版的区别就在于社会化。Yammer 将企业内部沟通进行了社会化改造，它不仅仅是「企业微博」那么简单。<br><br><ul><li><b>实时（Real-time）</b></li></ul>　　Twitter/微博类的互联网产品，本身就是实时互联网（Real-time Web）的雏形。而它们在手机上的病毒式蔓延也正是用户选择的结果，而非原因。互联网上产生的大量信息将不再仅仅汇总于一个静态页面，而会更多以 feed 形态实时传输，再在不同的产品形态中进行呈现和交互。<br>　　例子：IM 原本不是新鲜概念，但 Kik 将实时做到了极致，从而引发大规模流行。Path 设计简单，但对 Life Stream 的呈现因实时化而更加突出。 
1293302749,知识密集型企业内最好的信息管理和分享平台是什么？, 国外已经有不少产品试图满足这些需求了——<br><ul><li>Yammer</li><li>Flowr</li><li>CubeTree</li><li>Socialcast</li><li>MangoSpring</li><li>Braintrust</li></ul>
